{
  "$schema": "./mobiflight-config.schema.json",
  "ProductName": "CfMega",
  "ModuleName": "MF Mega Pro",
  "ModuleSerial": "SN-3F1-FDD",
  "outputs": {
    "Stepper": {
      "Stepper": [
        {
          "Name": "ENG RPM"
        }
      ]
    }
  },
  "inputs": {
    "AnalogInput": {
      "Analog": [
        {
          "Name": "Axis",
          "MapToBit": 10
        }
      ]
    },
    "Encoder": {
      "Encoder_small": [
        {
          "Name": "G1000 FMS inner",
          "MapToBits": [
            0,
            1,
            2,
            3
          ]
        }
      ],
      "Encoder_big": [
        {
          "Name": "G1000 FMS outer",
          "MapToBits": [
            4,
            5,
            6,
            7
          ]
        }
      ]
    },
    "Button": {
      "FMS push": [
        {
          "Name": "G1000 FMS push",
          "Pin": 0,
          "MapToBit": 8
        }
      ],
      "ENT": [
        {
          "Name": "G1000 ENT",
          "Pin": 0,
          "MapToBit": 9
        }
      ]
    }
  }
}
